{
  "$schema": "http://json-schema.org/draft-07/schema#",
  "type": "object",
  "properties": {
    "orderId": {"type": "string"},
    "customerId": {"type": "string"},
    "customerFirstName": {"type": "string"},
    "customerLastName": {"type": "string"},
    "customerEmail": {"type": "string"},
    "customerPhone": {"type": "string"},
    "customerDateOfBirth": {"type": "string"},
    "billingStreet": {"type": "string"},
    "billingSuite": {"type": "string"},
    "billingCity": {"type": "string"},
    "billingState": {"type": "string"},
    "billingZipCode": {"type": "string"},
    "billingCountry": {"type": "string"},
    "shippingStreet": {"type": "string"},
    "shippingApartment": {"type": "string"},
    "shippingCity": {"type": "string"},
    "shippingState": {"type": "string"},
    "shippingZipCode": {"type": "string"},
    "shippingCountry": {"type": "string"},
    "items": {
      "type": "array",
      "items": {
        "type": "object",
        "properties": {
          "productId": {"type": "string"},
          "name": {"type": "string"},
          "category": {"type": "string"},
          "price": {"type": "number"},
          "quantity": {"type": "integer"},
          "specifications": {
            "type": "object",
            "properties": {
              "brand": {"type": "string"},
              "model": {"type": "string"},
              "color": {"type": "string"},
              "weight": {"type": "string"},
              "batteryLife": {"type": "string"},
              "length": {"type": "string"},
              "dataTransfer": {"type": "string"},
              "powerDelivery": {"type": "string"},
              "material": {"type": "string"},
              "adjustable": {"type": "boolean"},
              "maxWeight": {"type": "string"},
              "dimensions": {"type": "string"}
            }
          }
        }
      }
    },
    "paymentMethod": {"type": "string"},
    "cardLast4": {"type": "string"},
    "cardBrand": {"type": "string"},
    "cardExpiryMonth": {"type": "string"},
    "cardExpiryYear": {"type": "string"},
    "transactionId": {"type": "string"},
    "paymentAmount": {"type": "number"},
    "paymentCurrency": {"type": "string"},
    "paymentStatus": {"type": "string"},
    "shippingMethod": {"type": "string"},
    "shippingCarrier": {"type": "string"},
    "trackingNumber": {"type": "string"},
    "estimatedDelivery": {"type": "string"},
    "shippingCost": {"type": "number"},
    "createdAt": {"type": "string"},
    "updatedAt": {"type": "string"},
    "source": {"type": "string"},
    "salesRep": {"type": "string"},
    "promotionCodes": {
      "type": "array",
      "items": {"type": "string"}
    },
    "notes": {"type": "string"}
  },
  "required": ["orderId", "customerId", "items"]
}
