{
  "orderId": "order-98765",
  "customerId": "cust-54321",
  "customerFirstName": "Robert",
  "customerLastName": "Johnson",
  "customerEmail": "robert.johnson@enterprise.com",
  "customerPhone": "212-555-0123",
  "customerDateOfBirth": "1985-03-22",
  "billingStreet": "456 Enterprise Blvd",
  "billingSuite": "Suite 789",
  "billingCity": "New York",
  "billingState": "NY",
  "billingZipCode": "10001",
  "billingCountry": "USA",
  "shippingStreet": "123 Delivery Lane",
  "shippingApartment": "Apt 4B",
  "shippingCity": "Brooklyn",
  "shippingState": "NY",
  "shippingZipCode": "11201",
  "shippingCountry": "USA",
  "items": [
    {
      "productId": "prod-001",
      "name": "Wireless Bluetooth Headphones",
      "category": "Electronics",
      "price": 199.99,
      "quantity": 2,
      "specifications": {
        "brand": "TechCorp",
        "model": "WH-1000XM4",
        "color": "Black",
        "weight": "254g",
        "batteryLife": "30 hours",
        "length": "",
        "dataTransfer": "",
        "powerDelivery": "",
        "material": "",
        "adjustable": false,
        "maxWeight": "",
        "dimensions": ""
      }
    },
    {
      "productId": "prod-002",
      "name": "USB-C Charging Cable",
      "category": "Accessories",
      "price": 24.99,
      "quantity": 3,
      "specifications": {
        "brand": "CableCorp",
        "model": "",
        "color": "White",
        "weight": "",
        "batteryLife": "",
        "length": "6 feet",
        "dataTransfer": "480 Mbps",
        "powerDelivery": "100W",
        "material": "",
        "adjustable": false,
        "maxWeight": "",
        "dimensions": ""
      }
    },
    {
      "productId": "prod-003",
      "name": "Laptop Stand",
      "category": "Office Supplies",
      "price": 89.99,
      "quantity": 1,
      "specifications": {
        "brand": "ErgoCorp",
        "model": "",
        "color": "",
        "weight": "",
        "batteryLife": "",
        "length": "",
        "dataTransfer": "",
        "powerDelivery": "",
        "material": "Aluminum",
        "adjustable": true,
        "maxWeight": "15 lbs",
        "dimensions": "12x10x6 inches"
      }
    }
  ],
  "paymentMethod": "credit_card",
  "cardLast4": "4321",
  "cardBrand": "Visa",
  "cardExpiryMonth": "12",
  "cardExpiryYear": "2025",
  "transactionId": "txn-abc123def456",
  "paymentAmount": 489.95,
  "paymentCurrency": "USD",
  "paymentStatus": "completed",
  "shippingMethod": "standard",
  "shippingCarrier": "FedEx",
  "trackingNumber": "1234567890123456",
  "estimatedDelivery": "2023-12-15",
  "shippingCost": 9.99,
  "createdAt": "2023-12-10T09:15:30Z",
  "updatedAt": "2023-12-10T09:16:45Z",
  "source": "web",
  "salesRep": "sales-rep-789",
  "promotionCodes": ["SAVE10", "FREESHIP"],
  "notes": "Customer requested expedited processing"
}
